{
  "schema_version": "1",
  "card_sha256": "5e6f1d7808fdac63ee5c4cf5e399f272b109383322703174424dbb6474472de4",
  "verdict": "VALID",
  "reviewer": {
    "family": "gpt",
    "backend": "codex",
    "model": "gpt-5.6-sol",
    "session": "019fe0f0-f003-7eb0-b754-3a856f591a8c"
  },
  "checked": {
    "statement_complete": {
      "value": true,
      "note": "read refs/sources/widget.txt:3-4 in full against the record"
    },
    "hypotheses_complete": {
      "value": true,
      "note": "one hypothesis, the d-regularity clause, anchored at line 4"
    },
    "translation_faithful": {
      "value": true,
      "note": "statement_blessed carries both the conclusion and the hypothesis"
    },
    "signature_faithful": {
      "value": true,
      "note": "pre names the bounded-degree widget graph"
    }
  },
  "findings": []
}
